{
  "title": "ChronoGrid Conformance Report",
  "version": "0.9.0",
  "cgStd": "CG-STD-5100 v1.4",
  "sprint": "Sprint 11-A",
  "mode": "black-box",
  "target": "http://127.0.0.1:3000",
  "generatedAt": "2026-06-01T15:02:19.017Z",
  "conformance": {
    "level": 3,
    "passed": 22,
    "failed": 3,
    "skipped": 30,
    "total": 55,
    "compliant": false
  },
  "pending": {
    "pending_v12": 10,
    "pending_sprint_11b": 20,
    "details": {
      "worm_oais": 5,
      "geo_redundancy": 5,
      "rk45_classb": 5,
      "graphql_sub": 5,
      "event_bus_mtls": 5,
      "anchoring_audit": 5
    }
  },
  "results": [
    {
      "id": "BB-001",
      "level": 1,
      "passed": true,
      "durationMs": 7
    },
    {
      "id": "BB-002",
      "level": 1,
      "passed": true,
      "durationMs": 2
    },
    {
      "id": "BB-003",
      "level": 1,
      "passed": true,
      "durationMs": 5
    },
    {
      "id": "BB-010",
      "level": 2,
      "passed": true,
      "durationMs": 3
    },
    {
      "id": "BB-011",
      "level": 2,
      "passed": true,
      "durationMs": 2
    },
    {
      "id": "BB-020",
      "level": 2,
      "passed": true,
      "durationMs": 2
    },
    {
      "id": "BB-021",
      "level": 2,
      "passed": true,
      "durationMs": 3
    },
    {
      "id": "BB-022",
      "level": 2,
      "passed": true,
      "durationMs": 7
    },
    {
      "id": "BB-030",
      "level": 2,
      "passed": true,
      "durationMs": 10
    },
    {
      "id": "BB-031",
      "level": 2,
      "passed": true,
      "durationMs": 4
    },
    {
      "id": "BB-032",
      "level": 2,
      "passed": true,
      "durationMs": 4
    },
    {
      "id": "BB-033",
      "level": 2,
      "passed": true,
      "durationMs": 19
    },
    {
      "id": "BB-040",
      "level": 2,
      "passed": true,
      "durationMs": 2
    },
    {
      "id": "BB-041",
      "level": 2,
      "passed": true,
      "durationMs": 2
    },
    {
      "id": "BB-042",
      "level": 2,
      "passed": true,
      "durationMs": 1
    },
    {
      "id": "BB-050",
      "level": 2,
      "passed": true,
      "durationMs": 9
    },
    {
      "id": "BB-051",
      "level": 2,
      "passed": true,
      "durationMs": 1
    },
    {
      "id": "BB-060",
      "level": 2,
      "passed": true,
      "durationMs": 9
    },
    {
      "id": "BB-070",
      "level": 2,
      "passed": true,
      "durationMs": 8
    },
    {
      "id": "BB-071",
      "level": 2,
      "passed": true,
      "durationMs": 2
    },
    {
      "id": "BB-080",
      "level": 2,
      "passed": true,
      "durationMs": 15
    },
    {
      "id": "BB-090",
      "level": 2,
      "passed": false,
      "durationMs": 6,
      "error": "Erwartet: true, Erhalten: false"
    },
    {
      "id": "BB-091",
      "level": 3,
      "passed": false,
      "durationMs": 30,
      "error": "Erwartet: 200, Erhalten: 404"
    },
    {
      "id": "BB-092",
      "level": 3,
      "passed": false,
      "durationMs": 21,
      "error": "Erwartet: 410, Erhalten: 404"
    },
    {
      "id": "BB-099",
      "level": 3,
      "passed": true,
      "durationMs": 1
    }
  ]
}